artist,track_name,lyrics,Genre,letras_limpas,Silabas,Frequencia,Pontuacao Gramatical,diversidade lexical,diversidade tematica,Tamanho,Versos,Polaridade,Complexidade
tamela-mann,187 - 187 - through-it-all," <p>Life's thrown many punches<br/>Trying hard to knock me out<br/>It's hard but I'm fighting<br/>Can't let my faith waiver now</p><p>Change don't always feel good<br/>But I know that it's working for me<br/>As long as I keep standing<br/>You'll give me the victory</p><p>Because you promised in your word<br/>That you will never leave me<br/>You will never leave me nor forsake me, no</p><p>Through it all, you're with me, yeah<br/>Through ever tear, through every pain, Lord<br/>Through it all, you're with me, yeah<br/>Every mountain high, every valley low</p><p>Ooh sometimes I feel alone<br/>My heart is broken, shattered<br/>It hurts but I'm trying</p><p>They say don't ask you questions<br/>But Lord why me?<br/>If you trust me within<br/>Then you'll give me the victory</p><p>Cause I know what you said in your word<br/>That you will never leave me<br/>Nor forsake me</p><p>Through it all you're with me<br/>Through ever tear, through every cry, Lord<br/>Thank you for being right there<br/>Thank you for hearing every cry<br/>Every mountain high, every valley low</p><p>Because I have your promise<br/>I will stand tall<br/>Your word requires that I<br/>I'll be strong<br/>Lord to follow in your presence<br/>I'll risk it all, you'll be right there<br/>Through it all<br/>And we'll say all</p><p>You say you'll never leave me<br/>You say you'll never left me alone</p><p>You say you'll never leave me<br/>You say you'll never leave me<br/>And you've never ever left me alone</p><p>Through it all<br/>You've been right there<br/>You'll never leave me nor forsake me Lord<br/>Through it all<br/>I thank you lord<br/>You're with me yeah</p><p>Oh, through it all<br/>I've learned to trust in Jesus<br/>I've learned to trust in God<br/>Through it all<br/>Oh, through it all<br/>Stand on your every word</p><p>When my friends forsake me<br/>My momma and daddy couldn't do it<br/>I can call on you Lord<br/>You've been right there<br/>You've been right there<br/>Through it all</p> ",Folk,"life's thrown many punches
trying hard to knock me out
it's hard but i'm fighting
can't let my faith waiver now
 change don't always feel good
but i know that it's working for me
as long as i keep standing
you'll give me the victory
 because you promised in your word
that you will never leave me
you will never leave me nor forsake me, no
 through it all, you're with me, yeah
through ever tear, through every pain, lord
through it all, you're with me, yeah
every mountain high, every valley low
 ooh sometimes i feel alone
my heart is broken, shattered
it hurts but i'm trying
 they say don't ask you questions
but lord why me?
if you trust me within
then you'll give me the victory
 cause i know what you said in your word
that you will never leave me
nor forsake me
 through it all you're with me
through ever tear, through every cry, lord
thank you for being right there
thank you for hearing every cry
every mountain high, every valley low
 because i have your promise
i will stand tall
your word requires that i
i'll be strong
lord to follow in your presence
i'll risk it all, you'll be right there
through it all
and we'll say all
 you say you'll never leave me
you say you'll never left me alone
 you say you'll never leave me
you say you'll never leave me
and you've never ever left me alone
 through it all
you've been right there
you'll never leave me nor forsake me lord
through it all
i thank you lord
you're with me yeah
 oh, through it all
i've learned to trust in jesus
i've learned to trust in god
through it all
oh, through it all
stand on your every word
 when my friends forsake me
my momma and daddy couldn't do it
i can call on you lord
you've been right there
you've been right there
through it all",0.0,0.3776435045317221,1.7600000000000013,3.866318,0.4174348255554244,331,1.2448979591836735,0.13047619047619044,0
tamela-mann,188 - 188 - what-do-you-do?," <p>Father can you hear me<br/>We need your love today<br/>I know that you are listening<br/>you hear men everyday<br/>Father please hear us<br/>and we will be ok<br/>father we need you to heal families today</p><p>Father can you hear me<br/>I'm calling on your name<br/>Not budda nor muhammed<br/>but it's jesus we cry out loud<br/>Father just forgive us<br/>Hear us when we say<br/>We'll give ya, give ya, give you everything our lifes and souls today</p><p>Father you know we need it<br/>I've never seen so much pain<br/>We have the faith for now<br/>Your victory we will gain<br/>father you know we mean it<br/>there's no more heart of stone<br/>were ready for your power<br/>now the sin is gone</p><p>Lead:Father<br/>Choir: Can you hear me now<br/>(REPEAT 4X's)</p><p>Choir: He will say</p><p>Lead: He will say yes<br/>Choir: yes, yes, yes, yes</p><p>Lead: say yes lord<br/>Choir: yes, yes</p><p>Lead: yes to your will jesus, yes to your will<br/>Choir: yes, yes</p><p>Lead: come on say yes<br/>Choir: yes, yes, yes, yes</p><p>Lead: say yes<br/>Choir: yes, yes</p><p>Lead: come on raise your hand an say yes<br/>Choir: yes, yes</p><p>Ooh Lord can you heal even me lord see I'm comin to you lord just as<br/>I am I'm in need of the blood of the lamb oh my oh my soul say yes</p><p>ad lib and the choir continues with ""yes,yes""</p> ",Folk,"father can you hear me
we need your love today
i know that you are listening
you hear men everyday
father please hear us
and we will be ok
father we need you to heal families today
 father can you hear me
i'm calling on your name
not budda nor muhammed
but it's jesus we cry out loud
father just forgive us
hear us when we say
we'll give ya, give ya, give you everything our lifes and souls today
 father you know we need it
i've never seen so much pain
we have the faith for now
your victory we will gain
father you know we mean it
there's no more heart of stone
were ready for your power
now the sin is gone
 lead:father
choir: can you hear me now
(repeat 4x's)
 choir: he will say
 lead: he will say yes
choir: yes, yes, yes, yes
 lead: say yes lord
choir: yes, yes
 lead: yes to your will jesus, yes to your will
choir: yes, yes
 lead: come on say yes
choir: yes, yes, yes, yes
 lead: say yes
choir: yes, yes
 lead: come on raise your hand an say yes
choir: yes, yes
 ooh lord can you heal even me lord see i'm comin to you lord just as
i am i'm in need of the blood of the lamb oh my oh my soul say yes
 ad lib and the choir continues with ""yes,yes""",1.0,0.46218487394957986,1.0400000000000007,4.0255356,0.3965782058418043,238,1.1388888888888888,0.0921875,0
tamela-mann,189 - 189 - help-me," <p>I've come to get my blessing<br/>I've gotta get my breakthrough<br/>The power of my praise<br/>Gives me strength so I can press on through</p><p>So I gotta stretch<br/>Stretch forth, reaching for my blessing<br/>So I gotta press<br/>Press forth, reaching for my blessing</p><p>{Gotta get my} gotta get my blessing<br/>{I believe he'll work a} miracle<br/>The power of my praise<br/>Give me strength so I can press on through</p><p>Chorus<br/>{So I gotta} Stretch<br/>Stretchin for it, reaching for my blessing (3x)<br/>Oh-Oh(after 1st &amp; 3rd)</p><p>Bridge<br/>I'm still believing for my miracle my faith says<br/>It's special it's marvelous and it's wonderful<br/>Wonderful</p><p>Vamp<br/>Reach for it (4x)<br/>The mark, the prize, the higher calling<br/>Move towards it(4x)<br/>The mark, the prize, the higher calling<br/>Stretch for it(4x)<br/>The mark, the prize, the higher calling<br/>Leap for it(4x)<br/>The mark, the prize, the higher calling<br/>Yes, Gotta get my blessing(6x)<br/>The mark, the prize, the higher calling<br/>It's mine, gotta get my blessing(4x)<br/>The mark, the prize the higher calling<br/>Yes, I gotta get my blessing</p> ",Folk,"i've come to get my blessing
i've gotta get my breakthrough
the power of my praise
gives me strength so i can press on through
 so i gotta stretch
stretch forth, reaching for my blessing
so i gotta press
press forth, reaching for my blessing
 {gotta get my} gotta get my blessing
{i believe he'll work a} miracle
the power of my praise
give me strength so i can press on through
 chorus
{so i gotta} stretch
stretchin for it, reaching for my blessing (3x)
oh-oh(after 1st &amp; 3rd)
 bridge
i'm still believing for my miracle my faith says
it's special it's marvelous and it's wonderful
wonderful
 vamp
reach for it (4x)
the mark, the prize, the higher calling
move towards it(4x)
the mark, the prize, the higher calling
stretch for it(4x)
the mark, the prize, the higher calling
leap for it(4x)
the mark, the prize, the higher calling
yes, gotta get my blessing(6x)
the mark, the prize, the higher calling
it's mine, gotta get my blessing(4x)
the mark, the prize the higher calling
yes, i gotta get my blessing",1.0,0.4,0.9200000000000006,2.834086,0.671624736756434,180,1.1724137931034482,0.4415584415584416,0
tamela-mann,190 - 190 - this-place," <p>Never knew my life could be this way, mmmm<br/>I never knew the sun could shine all day<br/>Never thought I'd live beyond my past<br/>Until I found Jesus, I never thought I'd be in this place<br/>Oh I'm glad, so glad, I'm living my life in this place</p><p>Never knew my heart could feel again<br/>Never knew the pain would let me stand<br/>Never thought my tears could go away<br/>Till I found Jesus, I never thought I'd be in this place<br/>Oh I'm glad I'm living my life in this place</p><p>There's a place in God where we can all be free<br/>A place where God can get the best out of me<br/>There's a secret place in God where He covers me</p><p>Oh I'm glad I'm living my life in this place<br/>Oh I'm glad I'm living my life in this place</p><p>Been a lot places seen a lot of faces<br/>But I never been in this place<br/>Time and time again never thought I'd win<br/>But I never been in this place</p><p>This place, this place<br/>This place, this place</p><p>This place, this place</p><p>Oh I'm glad I'm living my life in this place<br/>Yes I'm glad I'm living my life in this place</p> ",Folk,"never knew my life could be this way, mmmm
i never knew the sun could shine all day
never thought i'd live beyond my past
until i found jesus, i never thought i'd be in this place
oh i'm glad, so glad, i'm living my life in this place
 never knew my heart could feel again
never knew the pain would let me stand
never thought my tears could go away
till i found jesus, i never thought i'd be in this place
oh i'm glad i'm living my life in this place
 there's a place in god where we can all be free
a place where god can get the best out of me
there's a secret place in god where he covers me
 oh i'm glad i'm living my life in this place
oh i'm glad i'm living my life in this place
 been a lot places seen a lot of faces
but i never been in this place
time and time again never thought i'd win
but i never been in this place
 this place, this place
this place, this place
 this place, this place
 oh i'm glad i'm living my life in this place
yes i'm glad i'm living my life in this place",0.0,0.3269230769230769,1.0800000000000007,4.243042,0.3503884295524914,208,1.3333333333333333,0.39895104895104894,0
tamela-mann,191 - 191 - in-the-morning," <p>[Verse 1:]<br/>There's a time has come for you to realize<br/>that you can trust me, 'cause you know I will provide.<br/>I'll never leave you, I'll never leave you alone,<br/>that's why my child you must hold on</p><p>[Chorus:]<br/>Im in your corner (yeah yeah)<br/>I hear you when ya call (hear you when)<br/>Im in your corner (and i catch you when)<br/>Catch you when you fall (yeah yeah)<br/>Im in your corner (Oh yes i will)<br/>See you through it all (im in your corner)<br/>Im in your corner through it all</p><p>[Verse 2:]<br/>Oh my child, I heard you when you called<br/>and though you fell, I was there through it all.<br/>Tests and trials come to make you strong<br/>Thats why my child, you must hold on</p><p>[Chorus:]<br/>Im in your corner (yeah yeah I will be there)<br/>Hear you when you call (hear you when)<br/>Im in your corner (and i catch you when)<br/>Catch you when you fall (yes i will)<br/>Im in your corner (I will be there)<br/>See you through it all (hold on)<br/>Im in your corner through it all (oooo i will)<br/>[repeat chorus]</p><p>[Bridge:]<br/>I hear you everytime you call (everytime you call) (and i will be there)<br/>Be there to catch you when you fall (catch you when you fall)<br/>I'll be there to see you through it all<br/>On my name you just have to call</p><p>[repeat chorus]</p> ",Folk,"[verse 1:]
there's a time has come for you to realize
that you can trust me, 'cause you know i will provide.
i'll never leave you, i'll never leave you alone,
that's why my child you must hold on
 [chorus:]
im in your corner (yeah yeah)
i hear you when ya call (hear you when)
im in your corner (and i catch you when)
catch you when you fall (yeah yeah)
im in your corner (oh yes i will)
see you through it all (im in your corner)
im in your corner through it all
 [verse 2:]
oh my child, i heard you when you called
and though you fell, i was there through it all.
tests and trials come to make you strong
thats why my child, you must hold on
 [chorus:]
im in your corner (yeah yeah i will be there)
hear you when you call (hear you when)
im in your corner (and i catch you when)
catch you when you fall (yes i will)
im in your corner (i will be there)
see you through it all (hold on)
im in your corner through it all (oooo i will)
[repeat chorus]
 [bridge:]
i hear you everytime you call (everytime you call) (and i will be there)
be there to catch you when you fall (catch you when you fall)
i'll be there to see you through it all
on my name you just have to call
 [repeat chorus]",0.0,0.38016528925619836,1.0800000000000007,2.9321294,0.4824396695342344,242,1.1,0.48888888888888893,0
tamela-mann,192 - 192 - the-master-plan," <p>You may be wondering<br/>What's gonna happen<br/>How you gonna fix it?<br/>With nowhere to turn</p><p>With the weight<br/>So much weight on your shoulders<br/>And it seems nobody cares</p><p>Oh, hold on<br/>God's got the answer, yes he does<br/>To those questions you don't understand</p><p>You don't have to worry<br/>God's got, yeah, he has the master plan<br/>Yes he does, oh</p><p>The father knows, what's best for you, yes he does<br/>God always knows how to provide for you<br/>He always, always see you through, yes he has<br/>Hold on to what he's promised you</p><p>Hold on, God's got the answer<br/>Oh, oh, to those questions, to those questions<br/>My God, you don't understand, hold on<br/>Hold on my brother, hold on my sister</p><p>Yes my God, he's got, he's got the master plan<br/>Yes he does<br/>Whatever it is, God's got it<br/>You've been searching, he has it right there</p><p>My God has everything you need<br/>I dare you to try him<br/>I dare you to reach out for him<br/>He's knocking, he's knocking</p><p>He wants to come in, he's on the outside<br/>He has the answer, the master plan<br/>My God has, he has it, he has the master plan<br/>Yes, yes he does, hallelujah, he has the master plan</p> ",Folk,"you may be wondering
what's gonna happen
how you gonna fix it?
with nowhere to turn
 with the weight
so much weight on your shoulders
and it seems nobody cares
 oh, hold on
god's got the answer, yes he does
to those questions you don't understand
 you don't have to worry
god's got, yeah, he has the master plan
yes he does, oh
 the father knows, what's best for you, yes he does
god always knows how to provide for you
he always, always see you through, yes he has
hold on to what he's promised you
 hold on, god's got the answer
oh, oh, to those questions, to those questions
my god, you don't understand, hold on
hold on my brother, hold on my sister
 yes my god, he's got, he's got the master plan
yes he does
whatever it is, god's got it
you've been searching, he has it right there
 my god has everything you need
i dare you to try him
i dare you to reach out for him
he's knocking, he's knocking
 he wants to come in, he's on the outside
he has the answer, the master plan
my god has, he has it, he has the master plan
yes, yes he does, hallelujah, he has the master plan",0.0,0.4439252336448598,1.0100000000000007,3.8600824,0.5205370343161981,214,1.0,0.33714285714285713,0
tamela-mann,193 - 193 - he-did-it-for-me," <p>Sitting here thinking 'bout where I am now<br/>And I'm where I'm supposed to be<br/>In the middle of His will I believe, I believe</p><p>Some people try to tell me I'm not worthy of my destiny<br/>But I'm so glad they didn't give it to me</p><p>They were not there when I cried, Lord, I need Your help<br/>And You replied, I'm taking care of this Myself, Myself</p><p>Ways being made out of no way<br/>He's doing it, He's doing it for me<br/>The change you see in me today<br/>He's doing it, He's doing it for me</p><p>When they ask me how I made it through<br/>I can say You came to my rescue<br/>This victory points back to You<br/>God did it, He did it for me</p><p>Not saying I deserve it all<br/>Just saying I heard His call<br/>No matter what you see<br/>He believes in me<br/>He chose me</p><p>The gifts He gave me aren't easy to carry<br/>I often wonder why He gave them to me</p><p>They did not hear when I cried Lord, I need Your help<br/>And you replied, I'm taking care this Myself, Myself</p><p>Ways being made out of no way<br/>He is doing it for me<br/>The change you see in me today he's doing it, He's doing it for me</p><p>When they ask how I made it through<br/>I can say you came to my rescue<br/>This victory points back to You<br/>God did it, did it, did it, did it, did it<br/>He did it for me</p> ",Folk,"sitting here thinking 'bout where i am now
and i'm where i'm supposed to be
in the middle of his will i believe, i believe
 some people try to tell me i'm not worthy of my destiny
but i'm so glad they didn't give it to me
 they were not there when i cried, lord, i need your help
and you replied, i'm taking care of this myself, myself
 ways being made out of no way
he's doing it, he's doing it for me
the change you see in me today
he's doing it, he's doing it for me
 when they ask me how i made it through
i can say you came to my rescue
this victory points back to you
god did it, he did it for me
 not saying i deserve it all
just saying i heard his call
no matter what you see
he believes in me
he chose me
 the gifts he gave me aren't easy to carry
i often wonder why he gave them to me
 they did not hear when i cried lord, i need your help
and you replied, i'm taking care this myself, myself
 ways being made out of no way
he is doing it for me
the change you see in me today he's doing it, he's doing it for me
 when they ask how i made it through
i can say you came to my rescue
this victory points back to you
god did it, did it, did it, did it, did it
he did it for me",0.0,0.3861003861003861,1.310000000000001,3.7926297,0.5332238139157305,259,1.1428571428571428,0.1277777777777778,0
tamela-mann,194 - 194 - forever-done," <p>[Verse 1:]<br/>There's a time has come for you to realize<br/>that you can trust me, 'cause you know I will provide.<br/>I'll never leave you, I'll never leave you alone,<br/>that's why my child you must hold on</p><p>[Chorus:]<br/>Im in your corner (yeah yeah)<br/>I hear you when ya call (hear you when)<br/>Im in your corner (and i catch you when)<br/>Catch you when you fall (yeah yeah)<br/>Im in your corner (Oh yes i will)<br/>See you through it all (im in your corner)<br/>Im in your corner through it all</p><p>[Verse 2:]<br/>Oh my child, I heard you when you called<br/>and though you fell, I was there through it all.<br/>Tests and trials come to make you strong<br/>Thats why my child, you must hold on</p><p>[Chorus:]<br/>Im in your corner (yeah yeah I will be there)<br/>Hear you when you call (hear you when)<br/>Im in your corner (and i catch you when)<br/>Catch you when you fall (yes i will)<br/>Im in your corner (I will be there)<br/>See you through it all (hold on)<br/>Im in your corner through it all (oooo i will)<br/>[repeat chorus]</p><p>[Bridge:]<br/>I hear you everytime you call (everytime you call) (and i will be there)<br/>Be there to catch you when you fall (catch you when you fall)<br/>I'll be there to see you through it all<br/>On my name you just have to call</p><p>[repeat chorus]</p> ",Folk,"[verse 1:]
there's a time has come for you to realize
that you can trust me, 'cause you know i will provide.
i'll never leave you, i'll never leave you alone,
that's why my child you must hold on
 [chorus:]
im in your corner (yeah yeah)
i hear you when ya call (hear you when)
im in your corner (and i catch you when)
catch you when you fall (yeah yeah)
im in your corner (oh yes i will)
see you through it all (im in your corner)
im in your corner through it all
 [verse 2:]
oh my child, i heard you when you called
and though you fell, i was there through it all.
tests and trials come to make you strong
thats why my child, you must hold on
 [chorus:]
im in your corner (yeah yeah i will be there)
hear you when you call (hear you when)
im in your corner (and i catch you when)
catch you when you fall (yes i will)
im in your corner (i will be there)
see you through it all (hold on)
im in your corner through it all (oooo i will)
[repeat chorus]
 [bridge:]
i hear you everytime you call (everytime you call) (and i will be there)
be there to catch you when you fall (catch you when you fall)
i'll be there to see you through it all
on my name you just have to call
 [repeat chorus]",0.0,0.38016528925619836,1.0800000000000007,2.9321294,0.4824396695342344,242,1.1,0.48888888888888893,0
cece-winans,195 - 195 - your-grace-still-amazes-me," <p>I have faced many mountains<br/>Been through trials<br/>And shed many tears<br/>When I look around and it all seems hopeless<br/>I won’t fear<br/>I won’t fear</p><p>I’ll be still and know<br/>Know You are God<br/>You’re right here with me<br/>Through all my troubles<br/>I’ll be still and know<br/>Know You are God<br/>You are the light and rest for my soul<br/>You’re God and I’ll be still and know</p><p>When my heart feels anxious<br/>It’s Your voice that calms every storm<br/>When I find myself crying all through the night<br/>You remind me<br/>You remind me</p><p>To be still and know<br/>Know You are God<br/>You’re right here with me<br/>Through all my troublеs<br/>I’ll be still and know<br/>Know You are God<br/>You are thе light and rest for my soul<br/>You’re God and I’ll be still and know</p><p>You’re a well<br/>That never runs dry<br/>No valley too deep<br/>No mountain too high<br/>You are my strength<br/>And You are my guide<br/>Lord You’re in control<br/>So I’ll be still and know<br/>You’re a well<br/>That never runs dry<br/>No valley too deep<br/>No mountain too high<br/>You are my strength<br/>And You are my guide<br/>Lord You’re in control<br/>So I</p><p>I’ll be still and know<br/>Know You are God<br/>You’re right here with me<br/>Through all my troubles<br/>I’ll be still and know<br/>Know You are God<br/>You are the light and rest for my soul<br/>You’re God and I’ll be still and know<br/>I’ll be still<br/>Oh, yeah<br/>I’ll be still and know<br/>Not gonna move<br/>Gonna be still<br/>Oh, yeah<br/>Be still and know</p> ",Folk,"i have faced many mountains
been through trials
and shed many tears
when i look around and it all seems hopeless
i won’t fear
i won’t fear
 i’ll be still and know
know you are god
you’re right here with me
through all my troubles
i’ll be still and know
know you are god
you are the light and rest for my soul
you’re god and i’ll be still and know
 when my heart feels anxious
it’s your voice that calms every storm
when i find myself crying all through the night
you remind me
you remind me
 to be still and know
know you are god
you’re right here with me
through all my troublеs
i’ll be still and know
know you are god
you are thе light and rest for my soul
you’re god and i’ll be still and know
 you’re a well
that never runs dry
no valley too deep
no mountain too high
you are my strength
and you are my guide
lord you’re in control
so i’ll be still and know
you’re a well
that never runs dry
no valley too deep
no mountain too high
you are my strength
and you are my guide
lord you’re in control
so i
 i’ll be still and know
know you are god
you’re right here with me
through all my troubles
i’ll be still and know
know you are god
you are the light and rest for my soul
you’re god and i’ll be still and know
i’ll be still
oh, yeah
i’ll be still and know
not gonna move
gonna be still
oh, yeah
be still and know",0.0,0.29044117647058826,1.8500000000000014,4.1876593,0.4205259799438725,272,1.8125,0.1746130952380952,0
